{
  "accuracy_label_path": "accuracy_label.json",
  "counts": {
    "adjacency_rows": 9,
    "attribution_records": 5,
    "provinces": 6,
    "scenarios": 3,
    "sea_zones": 3
  },
  "data_vintage": "2026-07-10",
  "faces": {
    "atlas": {
      "pack_manifest": "atlas/atlas_manifest.json",
      "pack_type": "atlas-saas",
      "path": "atlas"
    },
    "game": {
      "pack_manifest": "pack/pack_manifest.json",
      "pack_type": "game-template",
      "path": "pack"
    }
  },
  "files": [
    "ACCURACY.md",
    "LICENSE_AUDIT.md",
    "README.md",
    "RECIPE.md",
    "accuracy_label.json",
    "atlas/README.md",
    "atlas/atlas_manifest.json",
    "atlas/attribution.json",
    "atlas/geojson/provinces.geojson",
    "atlas/scenarios/modern-baseline/countries.json",
    "atlas/scenarios/modern-baseline/legend.json",
    "atlas/scenarios/modern-baseline/owners.geojson",
    "atlas/scenarios/modern-baseline/ownership.csv",
    "atlas/scenarios/modern-baseline/ownership.json",
    "atlas/scenarios/modern-baseline/ownership_choropleth.geojson",
    "atlas/scenarios/modern-baseline/scenario_manifest.json",
    "atlas/scenarios/modern-baseline/tags.csv",
    "atlas/scenarios/modern-baseline/uncertainty.geojson",
    "atlas/scenarios/official-1444/countries.json",
    "atlas/scenarios/official-1444/legend.json",
    "atlas/scenarios/official-1444/owners.geojson",
    "atlas/scenarios/official-1444/ownership.csv",
    "atlas/scenarios/official-1444/ownership.json",
    "atlas/scenarios/official-1444/ownership_choropleth.geojson",
    "atlas/scenarios/official-1444/scenario_manifest.json",
    "atlas/scenarios/official-1444/tags.csv",
    "atlas/scenarios/official-1444/uncertainty.geojson",
    "atlas/scenarios/official-1836/countries.json",
    "atlas/scenarios/official-1836/legend.json",
    "atlas/scenarios/official-1836/owners.geojson",
    "atlas/scenarios/official-1836/ownership.csv",
    "atlas/scenarios/official-1836/ownership.json",
    "atlas/scenarios/official-1836/ownership_choropleth.geojson",
    "atlas/scenarios/official-1836/scenario_manifest.json",
    "atlas/scenarios/official-1836/tags.csv",
    "atlas/scenarios/official-1836/uncertainty.geojson",
    "atlas/tables/provinces.csv",
    "attribution.json",
    "license_audit.json",
    "pack/README.md",
    "pack/attribution.json",
    "pack/definitions/adjacency.csv",
    "pack/definitions/provinces.json",
    "pack/definitions/regions.json",
    "pack/definitions/sea_zones.json",
    "pack/geojson/provinces.geojson",
    "pack/geojson/regions.geojson",
    "pack/geojson/sea_zones.geojson",
    "pack/localization/english.json",
    "pack/localization/english.yml",
    "pack/pack_manifest.json",
    "pack/scenarios/modern-baseline/countries.json",
    "pack/scenarios/modern-baseline/ownership.csv",
    "pack/scenarios/modern-baseline/ownership.json",
    "pack/scenarios/modern-baseline/scenario_manifest.json",
    "pack/scenarios/official-1444/countries.json",
    "pack/scenarios/official-1444/ownership.csv",
    "pack/scenarios/official-1444/ownership.json",
    "pack/scenarios/official-1444/scenario_manifest.json",
    "pack/scenarios/official-1836/countries.json",
    "pack/scenarios/official-1836/ownership.csv",
    "pack/scenarios/official-1836/ownership.json",
    "pack/scenarios/official-1836/scenario_manifest.json",
    "pack/tables/population.csv",
    "pack/tables/terrain.csv",
    "recipe.json",
    "release_manifest.json",
    "sample/adjacency.csv",
    "sample/provinces.geojson",
    "sample/sea_zones.geojson"
  ],
  "generated_at": "2026-07-11T02:37:28+00:00",
  "generator_version": "0.1.0",
  "inputs": {
    "adjacency": "/tmp/gpm-beta-staging/adjacency.csv",
    "provinces": "/tmp/gpm-beta-staging/provinces.geojson",
    "sea_zones": "/tmp/gpm-beta-staging/sea_zones.geojson"
  },
  "is_sample": true,
  "license_audit_passed": true,
  "license_audit_path": "license_audit.json",
  "manifest_type": "release",
  "milestone": "M14",
  "notes": [
    "Public beta: license-audited sources with cleaned attribution pack.",
    "Restricted and share-alike paths are isolated and not mixed into this package.",
    "Geometry remains scaffold-baseline; politics may be curated-politics for official eras.",
    "Sea zones are gameplay abstractions, not legal maritime boundaries.",
    "Not Paradox-grade historical completeness worldwide."
  ],
  "pack": {
    "pack_manifest": "pack/pack_manifest.json",
    "pack_type": "game-template",
    "path": "pack"
  },
  "profile_id": "modern-small",
  "quality_tiers": {
    "geometry": "scaffold-baseline",
    "politics": "curated-politics"
  },
  "release_channel": "beta",
  "release_tag": "beta-0.1.0-sample-we",
  "sample_countries": [
    "FRA",
    "BEL",
    "NLD",
    "LUX",
    "DEU"
  ],
  "scenario_set": [
    "modern-baseline",
    "official-1836",
    "official-1444"
  ],
  "schema_version": "0.1.0"
}
